{"$schema":"https://json-schema.org/draft/2020-12/schema","$id":"https://engineering-platform.local/schemas/producer-readback-v1.schema.json","title":"Engineering Platform producer readback v1.1","type":"object","additionalProperties":false,"required":["contract_version","submission","producer","correlation","provenance","run","result","evidence"],"properties":{"contract_version":{"const":"1.1"},"submission":{"$ref":"#/$defs/submission"},"producer":{"$ref":"#/$defs/producer"},"correlation":{"$ref":"#/$defs/correlation"},"provenance":{"type":"object","additionalProperties":false,"required":["status","forge_execution"],"properties":{"status":{"enum":["PERSISTED","INVALID"]},"forge_execution":{"type":["object","null"]}}},"run":{"anyOf":[{"type":"null"},{"type":"object","additionalProperties":false,"required":["id","state","terminal","operator_resolution","updated_at"],"properties":{"id":{"type":"string","minLength":1},"state":{"type":"string","minLength":1},"terminal":{"type":"boolean"},"operator_resolution":{"type":"string"},"updated_at":{"type":"string"}}}]},"result":{"type":"object","additionalProperties":false,"required":["outcome","terminal","delivery_qualified"],"properties":{"outcome":{"enum":["NOT_STARTED","RUNNING","CLAIMED","COMPLETE","BLOCKED","FAILED"]},"terminal":{"type":"boolean"},"delivery_qualified":{"type":"boolean"}}},"evidence":{"type":"object","additionalProperties":false,"required":["status","terminal_artifact","repository"],"properties":{"status":{"enum":["NOT_TERMINAL","AVAILABLE","MISSING","CORRUPT","INCOMPLETE"]},"terminal_artifact":{"anyOf":[{"type":"null"},{"type":"object","additionalProperties":false,"required":["id","digest_algorithm","digest","content_type"],"properties":{"id":{"type":"string","pattern":"^terminal-evidence:"},"digest_algorithm":{"const":"sha256"},"digest":{"type":"string","pattern":"^sha256:[0-9a-f]{64}$"},"content_type":{"const":"application/json"}}}]},"repository":{"type":"object","additionalProperties":false,"required":["id","revision"],"properties":{"id":{"type":"string","minLength":1},"revision":{"type":["string","null"],"pattern":"^[0-9a-f]{40}$"}}}}}},"$defs":{"submission":{"type":"object","additionalProperties":false,"required":["id","project_id","repository_id","state","admission","transport","created_at","accepted_request_digest"],"properties":{"id":{"type":"string","minLength":1},"project_id":{"type":"string","minLength":1},"repository_id":{"type":"string","minLength":1},"state":{"type":"string"},"admission":{"const":"ADMITTED"},"transport":{"type":"string"},"created_at":{"type":"string"},"accepted_request_digest":{"type":"string","pattern":"^sha256:[0-9a-f]{64}$"}}},"producer":{"type":"object","additionalProperties":false,"required":["id","type","version"],"properties":{"id":{"type":"string","minLength":1},"type":{"type":"string","minLength":1},"version":{"type":["string","null"]}}},"correlation":{"type":"object","additionalProperties":false,"required":["correlation_id","mission_id","engineering_action_id"],"properties":{"correlation_id":{"type":["string","null"]},"mission_id":{"type":["string","null"]},"engineering_action_id":{"type":["string","null"]}}}}}
