{"contract_version":"1.1","correlation":{"correlation_id":"forge-correlation-fixture","engineering_action_id":"action-fixture","mission_id":"mission-fixture"},"evidence":{"repository":{"id":"forge","revision":"1111111111111111111111111111111111111111"},"status":"AVAILABLE","terminal_artifact":{"content_type":"application/json","digest":"sha256:90e376388fdac5fdec49cd1cee955b0a5d75515416dc515f9b9973d29355cb83","digest_algorithm":"sha256","id":"terminal-evidence:run-fixture"}},"producer":{"id":"forge","type":"FORGE","version":"1.0"},"provenance":{"forge_execution":{"action_id":"action-fixture","contract_version":"1.0","correlation_id":"forge-correlation-fixture","host_id":"engineering-platform","intent_id":"intent-fixture","intent_revision":"7","mission_id":"mission-fixture","mission_revision":"3","repository_id":"forge","retry_of_correlation_id":null,"runtime_prompt":{"content_digest":"sha256:aaaaaaaaaaaaaaaaaaaaaaaaaaaaaaaaaaaaaaaaaaaaaaaaaaaaaaaaaaaaaaaa","id":"runtime-prompt-fixture"}},"status":"PERSISTED"},"result":{"delivery_qualified":true,"outcome":"COMPLETE","terminal":true},"run":{"id":"run-fixture","operator_resolution":"NONE","state":"COMPLETE","terminal":true,"updated_at":"2026-09-07T00:00:00+00:00"},"submission":{"accepted_request_digest":"sha256:bbbbbbbbbbbbbbbbbbbbbbbbbbbbbbbbbbbbbbbbbbbbbbbbbbbbbbbbbbbbbbbb","admission":"ADMITTED","created_at":"2026-09-07T00:00:00+00:00","id":"submission-fixture","project_id":"forge","repository_id":"forge","state":"QUEUED","transport":"HTTP"}}
